{
  "version": "1.0.0",
  "lastUpdated": "2025-10-05T20:22:00.000Z",
  "providers": {
    "openai": {
      "id": "openai",
      "name": "OpenAI",
      "description": "OpenAI's GPT models and API",
      "envKey": "OPENAI_API_KEY",
      "package": "@pk-code/openai",
      "defaultModels": {
        "chat": "gpt-4o",
        "fast": "gpt-4o-mini",
        "embedding": "text-embedding-3-large",
        "image": "dall-e-3"
      },
      "capabilities": {
        "vision": true,
        "toolCalling": true,
        "streaming": true,
        "embedding": true,
        "imageGeneration": true,
        "maxContext": 128000,
        "supportsSystemMessages": true,
        "supportsParallelTools": true
      },
      "pricing": {
        "currency": "USD",
        "perMillionTokens": {
          "gpt-4o": {
            "input": 5.0,
            "output": 15.0
          },
          "gpt-4o-mini": {
            "input": 0.15,
            "output": 0.6
          }
        }
      },
      "endpoints": {
        "chat": "https://api.openai.com/v1/chat/completions",
        "embedding": "https://api.openai.com/v1/embeddings"
      }
    },
    "anthropic": {
      "id": "anthropic",
      "name": "Anthropic",
      "description": "Anthropic's Claude models",
      "envKey": "ANTHROPIC_API_KEY",
      "package": "@pk-code/anthropic",
      "defaultModels": {
        "chat": "claude-3-5-sonnet-20241022",
        "fast": "claude-3-5-haiku-20241022",
        "legacy": "claude-3-opus-20240229"
      },
      "capabilities": {
        "vision": true,
        "toolCalling": true,
        "streaming": true,
        "embedding": false,
        "imageGeneration": false,
        "maxContext": 200000,
        "supportsSystemMessages": true,
        "supportsParallelTools": true
      },
      "pricing": {
        "currency": "USD",
        "perMillionTokens": {
          "claude-3-5-sonnet-20241022": {
            "input": 3.0,
            "output": 15.0
          },
          "claude-3-5-haiku-20241022": {
            "input": 0.25,
            "output": 1.25
          }
        }
      },
      "endpoints": {
        "chat": "https://api.anthropic.com/v1/messages"
      }
    },
    "google": {
      "id": "google",
      "name": "Google AI",
      "description": "Google's Gemini models",
      "envKey": "GOOGLE_API_KEY",
      "package": "@pk-code/gemini",
      "defaultModels": {
        "chat": "gemini-1.5-pro",
        "fast": "gemini-1.5-flash",
        "embedding": "text-embedding-004"
      },
      "capabilities": {
        "vision": true,
        "toolCalling": true,
        "streaming": true,
        "embedding": true,
        "imageGeneration": false,
        "maxContext": 2097152,
        "supportsSystemMessages": true,
        "supportsParallelTools": true
      },
      "pricing": {
        "currency": "USD",
        "perMillionTokens": {
          "gemini-1.5-pro": {
            "input": 3.5,
            "output": 10.5
          },
          "gemini-1.5-flash": {
            "input": 0.075,
            "output": 0.3
          }
        }
      },
      "endpoints": {
        "chat": "https://generativelanguage.googleapis.com/v1beta/models",
        "embedding": "https://generativelanguage.googleapis.com/v1beta/models"
      }
    },
    "openrouter": {
      "id": "openrouter",
      "name": "OpenRouter",
      "description": "OpenRouter's model marketplace",
      "envKey": "OPENROUTER_API_KEY",
      "package": "@pk-code/openrouter",
      "defaultModels": {
        "chat": "anthropic/claude-3.5-sonnet",
        "fast": "meta-llama/llama-3.1-8b-instruct:free",
        "embedding": "openai/text-embedding-3-large"
      },
      "capabilities": {
        "vision": true,
        "toolCalling": true,
        "streaming": true,
        "embedding": true,
        "imageGeneration": false,
        "maxContext": 200000,
        "supportsSystemMessages": true,
        "supportsParallelTools": true
      },
      "pricing": {
        "currency": "USD",
        "perMillionTokens": {
          "anthropic/claude-3.5-sonnet": {
            "input": 3.0,
            "output": 15.0
          }
        }
      },
      "endpoints": {
        "chat": "https://openrouter.ai/api/v1/chat/completions",
        "embedding": "https://openrouter.ai/api/v1/embeddings"
      }
    },
    "cohere": {
      "id": "cohere",
      "name": "Cohere",
      "description": "Cohere's language models",
      "envKey": "COHERE_API_KEY",
      "package": "@pk-code/cohere",
      "defaultModels": {
        "chat": "command-r-plus",
        "fast": "command-r",
        "embedding": "embed-english-v3.0"
      },
      "capabilities": {
        "vision": false,
        "toolCalling": true,
        "streaming": true,
        "embedding": true,
        "imageGeneration": false,
        "maxContext": 128000,
        "supportsSystemMessages": true,
        "supportsParallelTools": false
      },
      "pricing": {
        "currency": "USD",
        "perMillionTokens": {
          "command-r-plus": {
            "input": 3.0,
            "output": 15.0
          },
          "command-r": {
            "input": 0.5,
            "output": 1.5
          }
        }
      },
      "endpoints": {
        "chat": "https://api.cohere.ai/v1/chat",
        "embedding": "https://api.cohere.ai/v1/embed"
      }
    },
    "qwen": {
      "id": "qwen",
      "name": "Qwen",
      "description": "Alibaba's Qwen models",
      "envKey": "QWEN_API_KEY",
      "package": "@pk-code/qwen",
      "defaultModels": {
        "chat": "qwen/qwen-2.5-72b-instruct",
        "fast": "qwen/qwen-2.5-7b-instruct",
        "embedding": "qwen/qwen-embedding-1"
      },
      "capabilities": {
        "vision": true,
        "toolCalling": true,
        "streaming": true,
        "embedding": true,
        "imageGeneration": false,
        "maxContext": 32768,
        "supportsSystemMessages": true,
        "supportsParallelTools": true
      },
      "pricing": {
        "currency": "USD",
        "perMillionTokens": {
          "qwen/qwen-2.5-72b-instruct": {
            "input": 2.0,
            "output": 6.0
          }
        }
      },
      "endpoints": {
        "chat": "https://api.qwen.ai/v1/chat/completions",
        "embedding": "https://api.qwen.ai/v1/embeddings"
      }
    },
    "together": {
      "id": "together",
      "name": "Together AI",
      "description": "Together AI's open source models",
      "envKey": "TOGETHER_API_KEY",
      "package": "@pk-code/together",
      "defaultModels": {
        "chat": "meta-llama/Meta-Llama-3.1-70B-Instruct-Turbo",
        "fast": "meta-llama/Meta-Llama-3.1-8B-Instruct-Turbo",
        "embedding": "togethercomputer/m2-bert-80M-8k-retrieval"
      },
      "capabilities": {
        "vision": false,
        "toolCalling": true,
        "streaming": true,
        "embedding": true,
        "imageGeneration": false,
        "maxContext": 131072,
        "supportsSystemMessages": true,
        "supportsParallelTools": true
      },
      "pricing": {
        "currency": "USD",
        "perMillionTokens": {
          "meta-llama/Meta-Llama-3.1-70B-Instruct-Turbo": {
            "input": 0.9,
            "output": 0.9
          }
        }
      },
      "endpoints": {
        "chat": "https://api.together.xyz/v1/chat/completions",
        "embedding": "https://api.together.xyz/v1/embeddings"
      }
    },
    "azure": {
      "id": "azure",
      "name": "Azure OpenAI",
      "description": "Microsoft's Azure OpenAI service",
      "envKey": "AZURE_OPENAI_API_KEY",
      "package": "@pk-code/azure",
      "defaultModels": {
        "chat": "gpt-4",
        "fast": "gpt-35-turbo",
        "embedding": "text-embedding-ada-002"
      },
      "capabilities": {
        "vision": true,
        "toolCalling": true,
        "streaming": true,
        "embedding": true,
        "imageGeneration": false,
        "maxContext": 128000,
        "supportsSystemMessages": true,
        "supportsParallelTools": true
      },
      "pricing": {
        "currency": "USD",
        "perMillionTokens": {
          "gpt-4": {
            "input": 30.0,
            "output": 60.0
          }
        }
      },
      "endpoints": {
        "chat": "{AZURE_OPENAI_ENDPOINT}/openai/deployments/{deployment}/chat/completions?api-version=2024-02-15-preview",
        "embedding": "{AZURE_OPENAI_ENDPOINT}/openai/deployments/{deployment}/embeddings?api-version=2024-02-15-preview"
      },
      "additionalEnvVars": ["AZURE_OPENAI_ENDPOINT", "AZURE_OPENAI_DEPLOYMENT"]
    }
  },
  "capabilityDefinitions": {
    "vision": {
      "name": "Vision",
      "description": "Can process and analyze images"
    },
    "toolCalling": {
      "name": "Tool Calling",
      "description": "Can call external tools and functions"
    },
    "streaming": {
      "name": "Streaming",
      "description": "Supports real-time streaming responses"
    },
    "embedding": {
      "name": "Embeddings",
      "description": "Can generate text embeddings"
    },
    "imageGeneration": {
      "name": "Image Generation",
      "description": "Can generate images from text"
    },
    "supportsSystemMessages": {
      "name": "System Messages",
      "description": "Supports system-level instructions"
    },
    "supportsParallelTools": {
      "name": "Parallel Tools",
      "description": "Can execute multiple tools in parallel"
    }
  }
}
